"DIA","SEM_COMPROMISSO","DURACAO_DIA","INICIO","FIM","DURACAO_COMPROMISSO","TITULO","LOCAL"
"02-02-2021","Não","170","09:30","10:00","30","""João Augusto Ribeiro Nardes, Ministro do Tribunal de Contas da União""","""Palácio do Planalto"""
"02-02-2021","Não","170","10:00","10:30","30","""André Luiz de Almeida, Ministro de Estado da Justiça e Segurança Pública""","""Palácio do Planalto"""
"02-02-2021","Não","170","10:30","10:50","20","""Braga Netto, Ministro-Chefe da Casa Civil da Presidência da República""","""Palácio do Planalto"""
"02-02-2021","Não","170","11:00","11:30","30","""Deputado Olival Marques (DEM/PA)""","""Palácio do Planalto"""
"02-02-2021","Não","170","15:00","16:00","60","""Pedro Cesar Sousa, Ministro-Chefe da Secretaria-Geral da Presidência da República interino""","""Palácio do Planalto"""
