"DIA","SEM_COMPROMISSO","DURACAO_DIA","INICIO","FIM","DURACAO_COMPROMISSO","TITULO","LOCAL"
"05-02-2021","Não","355","09:00","10:30","90","""Braga Netto, Ministro de Estado Chefe da Casa Civil da Presidência da República; Paulo Guedes, Ministro de Estado da Economia; Tarcísio Gomes de Freitas, Ministro de Estado da Infraestrutura; e Bento Albuquerque, Ministro de Estado de Minas e Energia""","""Palácio do Planalto"""
"05-02-2021","Não","355","10:30","11:30","60","""Coletiva à imprensa""","""Palácio do Planalto"""
"05-02-2021","Não","355","14:30","15:00","30","""Fernando Azevedo, Ministro de Estado da Defesa""","""Palácio do Planalto"""
"05-02-2021","Não","355","15:00","15:30","30","""Braga Netto, Ministro de Estado Chefe da Casa Civil da Presidência da República""","""Palácio do Planalto"""
"05-02-2021","Não","355","15:30","17:00","90","""Deputado Ricardo Izar (PP/SP)""","""Palácio do Planalto"""
"05-02-2021","Não","355","17:00","17:25","25","""Pedro Cesar Sousa, Ministro-Chefe da Secretaria-Geral da Presidência da República interino""","""Palácio do Planalto"""
"05-02-2021","Não","355","17:30","18:00","30","""Rogério Marinho, Ministro de Estado do Desenvolvimento Regional""","""Palácio do Planalto"""
