"DIA","SEM_COMPROMISSO","DURACAO_DIA","INICIO","FIM","DURACAO_COMPROMISSO","TITULO","LOCAL"
"24-03-2020","Não","270","07:30","08:05","35","""Ricardo Salles, Ministro de Estado do Meio Ambiente""","""Palácio da Alvorada"""
"24-03-2020","Não","270","08:30","09:00","30","""Ernesto Araújo, Ministro de Estado das Relações Exteriores; Tereza Cristina, Ministra de Estado da Agricultura, Pecuária e Abastecimento Ricardo Salles, Ministro de Estado do Meio Ambiente; Luiz Eduardo Ramos, Ministro-Chefe da Secretaria de Governo da Presidência da República; e General Douglas Bassoli, Secretário-Executivo do Gabinete de Segurança Institucional da Presidência da República""","""Palácio do Planalto"""
"24-03-2020","Não","270","09:00","09:30","30","""Telefonema - Xi Jinping, Presidente da República Popular da China""","""Palácio do Planalto"""
"24-03-2020","Não","270","09:30","10:45","75","""Videoconferência com Governadores do Centro-Oeste""","""Palácio do Planalto"""
"24-03-2020","Não","270","11:00","12:05","65","""Videoconferência com Governadores do Sul""","""Palácio do Planalto"""
"24-03-2020","Não","270","14:00","14:35","35","""Braga Netto, Ministro-Chefe da Casa Civil da Presidência da República; Onyx Lorenzoni, Ministro de Estado da Cidadania; Ricardo Salles, Ministro de Estado do Meio Ambiente; Luiz Eduardo Ramos, Ministro-Chefe da Secretaria de Governo da Presidência da República; Senador Flávio Bolsonaro (Sem Partido/RJ); Carlos Bolsonaro, Vereador do Município do Rio de Janeiro/RJ; e Paulo César Tinga, Ex-Jogador de Futebol""","""Palácio do Planalto"""
