"DIA","SEM_COMPROMISSO","DURACAO_DIA","INICIO","FIM","DURACAO_COMPROMISSO","TITULO","LOCAL"
"14-10-2020","Não","370","08:50","09:15","25","""Fábio Faria, Ministro de Estado das Comunicações; Marcos Pontes, Ministro de Estado da Ciência, Tecnologia e Inovações; e Jorge Antonio de Oliveira, Ministro-Chefe da Secretaria-Geral da Presidência da República""","""Palácio do Planalto"""
"14-10-2020","Não","370","09:15","10:00","45","""Marcos Pontes, Ministro de Estado da Ciência, Tecnologia e Inovações""","""Palácio do Planalto"""
"14-10-2020","Não","370","10:00","10:50","50","""Cerimônia de Posse do Sr. Eduardo Eugênio Gouvêa Vieira como Presidente da Federação das Indústrias do Estado do Rio de Janeiro - FIRJAN e do Centro Industrial do Rio de Janeiro - CIRJ (Videoconferência)""","""Palácio do Planalto"""
"14-10-2020","Não","370","11:00","12:30","90","""Eduardo Pazuello, Ministro de Estado da Saúde""","""Brasília/DF"""
"14-10-2020","Não","370","12:30","13:00","30","""Wanderlei César da Silva, lutador brasileiro de MMA""","""Palácio do Planalto"""
"14-10-2020","Não","370","14:25","14:50","25","""Pastor Gilmar Santos, Presidente da Convenção Nacional de Igrejas e Ministros das Assembleias de Deus no Brasil Cristo para Todos - CONIMADB""","""Palácio do Planalto"""
"14-10-2020","Não","370","15:10","15:40","30","""André Luiz de Almeida, Ministro de Estado da Justiça e Segurança Pública""","""Palácio do Planalto"""
"14-10-2020","Não","370","16:45","17:00","15","""Eduardo Pazuello, Ministro de Estado da Saúde; e Gustavo Montezano, Presidente do BNDES""","""Palácio do Planalto"""
"14-10-2020","Não","370","17:00","18:00","60","""Lançamento do Programa Genomas Brasil""","""Palácio do Planalto"""
