"DIA","SEM_COMPROMISSO","DURACAO_DIA","INICIO","FIM","DURACAO_COMPROMISSO","TITULO","LOCAL"
"07-10-2020","Não","345","09:00","09:30","30","""Luiz Eduardo Ramos, Ministro-Chefe da Secretaria de Governo da Presidência da República; e Deputado Léo Moraes (PODEMOS/RO), Líder do PODEMOS na Câmara dos Deputados""","""Palácio do Planalto"""
"07-10-2020","Não","345","10:00","10:30","30","""Fábio Faria, Ministro de Estados das Comunicações; Marcello Corrêa Petrelli, Presidente Executivo do Grupo RIC Santa Catarina""","""Palácio do Planalto"""
"07-10-2020","Não","345","11:30","12:00","30","""Braga Netto, Ministro-Chefe da Casa Civil da Presidência da República; Rogério Marinho, Ministro de Estado do Desenvolvimento Regional; e Luiz Eduardo Ramos, Ministro-Chefe da Secretaria de Governo da Presidência da República""","""Palácio do Planalto"""
"07-10-2020","Não","345","12:00","13:15","75","""Davi Alcolumbre, Presidente do Senado Federal; Braga Netto, Ministro-Chefe da Casa Civil da Presidência da República; Jorge Antonio de Oliveira, Ministro-Chefe da Secretaria-Geral da Presidência da República; Luiz Eduardo Ramos, Ministro-Chefe da Secretaria de Governo da Presidência da República; e Augusto Heleno, Ministro-Chefe do Gabinete de Segurança Institucional da Presidência da República""","""Palácio do Planalto"""
"07-10-2020","Não","345","14:20","15:20","60","""Paulo Guedes, Ministro de Estado da Economia; e Luiz Eduardo Ramos, Ministro-Chefe da Secretaria de Governo da Presidência da República""","""Palácio do Planalto"""
"07-10-2020","Não","345","15:20","15:50","30","""Jorge Antonio de Oliveira, Ministro-Chefe da Secretaria-Geral da Presidência da República""","""Palácio do Planalto"""
"07-10-2020","Não","345","16:00","16:30","30","""Fernando Azevedo, Ministro de Estado da Defesa""","""Palácio do Planalto"""
"07-10-2020","Não","345","17:00","18:00","60","""Lançamento do Programa Voo Simples""","""Palácio do Planalto"""
