"DIA","SEM_COMPROMISSO","DURACAO_DIA","INICIO","FIM","DURACAO_COMPROMISSO","TITULO","LOCAL"
"16-04-2019","Não","325","09:00","09:45","45","""Onyx Lorenzoni, Ministro-Chefe da Casa Civil da Presidência da República; Paulo Guedes, Ministro de Estado da Economia; Rubens Ometto Silveira Mello, Presidente do Grupo Cosan; Henrique Malta, Diretor da Cosan; Luís Henrique Guimarães, CEO da Raizen""","""Palácio do Planalto"""
"16-04-2019","Não","325","10:00","10:45","45","""Marcos Pontes, Ministro de Estado da Ciência, Tecnologia, Inovações e Comunicações, e Waldemar Gonçalves Ortunho Junior, Presidente da Telebras""","""Palácio do Planalto"""
"16-04-2019","Não","325","11:20","12:00","40","""Wagner Rosário, Ministro de Estado da Controladoria-Geral da União""","""Palácio do Planalto"""
"16-04-2019","Não","325","14:20","15:10","50","""Luiz Henrique Mandetta, Ministro de Estado da Saúde e Carlos Vital Tavares Corrêa Lima, Presidente do Conselho Federal de Medicina (CFM)""","""Palácio do Planalto"""
"16-04-2019","Não","325","15:20","16:25","65","""Deputado Júlio Cesar (PSD/PI), Vice-Líder do Partido; Pedro Guimarães, Presidente da Caixa Econômica Federal; Jodismar Amaro, Presidente da Federação Brasileira das Empresas Lotéricas (FEBRALOT); José Romero dos Santos Nascimento, Presidente da Associação dos Lotéricos de São Paulo e Interior e Associação dos Lotéricos (ALSPI); Deputado Estadual Georgiano Neto (PSD/PI); e Ex-Deputado Luiz Carlos Hauly (PSDB/PR)""","""Palácio do Planalto"""
"16-04-2019","Não","325","16:35","17:55","80","""Hamilton Mourão, Vice-Presidente da República; Onyx Lorenzoni, Ministro-Chefe da Casa Civil da Presidência da República; Paulo Guedes, Ministro de Estado da Economia; Tarcísio Gomes de Freitas, Ministro de Estado da Infraestrutura; Bento Albuquerque, Ministro de Estado de Minas e Energia; Deputada Joice Hasselmann (PSL/SP), Líder do Governo no Congresso Nacional; Roberto Castello Branco, Presidente da Petrobras; Almirante Eduardo Bacellar Leal Ferreira, Presidente do Conselho da Petrobras; e Décio Oddone, Diretor-Geral da Agência Nacional do Petróleo, Gás Natural e Biocombustíveis""","""Palácio do Planalto"""
