"DIA","SEM_COMPROMISSO","DURACAO_DIA","INICIO","FIM","DURACAO_COMPROMISSO","TITULO","LOCAL"
"01-09-2020","Não","400","08:00","09:40","100","""Luiz Eduardo Ramos, Ministro-Chefe da Secretaria de Governo da Presidência da República; e Parlamentares""","""Palácio da Alvorada"""
"01-09-2020","Não","400","10:00","10:30","30","""Ernesto Araújo, Ministro de Estado das Relações Exteriores""","""Palácio do Planalto"""
"01-09-2020","Não","400","14:00","15:00","60","""Braga Netto, Ministro-Chefe da Casa Civil da Presidência da República; Paulo Guedes, Ministro de Estado da Economia; Onyx Lorenzoni, Ministro de Estado da Cidadania; Jorge Antonio de Oliveira, Ministro-Chefe da Secretaria-Geral da Presidência da República; e Luiz Eduardo Ramos, Ministro-Chefe da Secretaria de Governo da Presidência da República""","""Palácio do Planalto"""
"01-09-2020","Não","400","15:00","16:30","90","""Homenagem póstuma ao músico Pinto do Acordeon""","""Palácio do Planalto"""
"01-09-2020","Não","400","17:00","18:00","60","""Lançamento do Programa Norte Conectado""","""Palácio do Planalto"""
"01-09-2020","Não","400","18:00","18:30","30","""Jorge Antonio de Oliveira, Ministro-Chefe da Secretaria-Geral da Presidência da República""","""Palácio do Planalto"""
"01-09-2020","Não","400","18:30","19:00","30","""Solenidade de Posse dos Senhores Ministros Mauro Campbell Marques e Raul Araújo Filho, nos cargos de Ministro Efetivo e Ministro Substituto do Tribunal Superior Eleitoral (videoconferência)""","""Palácio do Planalto"""
