"DIA","SEM_COMPROMISSO","DURACAO_DIA","INICIO","FIM","DURACAO_COMPROMISSO","TITULO","LOCAL"
"30-09-2020","Não","450","08:00","10:00","120","""Deputado Ricardo Barros (PP/PR), Líder do Governo na Câmara dos Deputados""","""Palácio da Alvorada"""
"30-09-2020","Não","450","10:30","11:20","50","""Paulo Guedes, Ministro de Estado da Economia; e Onyx Lorenzoni, Ministro de Estado da Cidadania""","""Palácio do Planalto"""
"30-09-2020","Não","450","11:20","12:00","40","""Braga Netto, Ministro-Chefe da Casa Civil da Presidência da República; Paulo Guedes, Ministro de Estado da Economia; e Jorge Antonio de Oliveira, Ministro-Chefe da Secretaria-Geral da Presidência da República""","""Palácio do Planalto"""
"30-09-2020","Não","450","15:10","15:40","30","""Lançamento da Política Nacional de Educação Especial e Homenagem ao Mês dos Surdos""","""Palácio do Planalto"""
"30-09-2020","Não","450","16:20","16:40","20","""Onyx Lorenzoni, Ministro Estado da Cidadania""","""Palácio do Planalto"""
"30-09-2020","Não","450","16:50","17:10","20","""Bento Albuquerque, Ministro de Estado de Minas e Energia""","""Palácio do Planalto"""
"30-09-2020","Não","450","17:20","17:40","20","""Cerimônia de Lançamento do Novo Crédito Habitacional para Assentados""","""Palácio do Planalto"""
"30-09-2020","Não","450","17:45","18:15","30","""Jorge Antonio de Oliveira, Ministro-Chefe da Secretaria-Geral da Presidência da República""","""Palácio do Planalto"""
"30-09-2020","Não","450","18:00","20:00","120","""Braga Netto, Ministro-Chefe da Casa Civil da Presidência da República; Paulo Guedes, Ministro de Estado da Economia; Jorge Antonio de Oliveira, Ministro-Chefe da Secretaria-Geral da Presidência da República; Luiz Eduardo Ramos Baptista Pereira, Ministro-Chefe da Secretaria de Governo da Presidência da República; Augusto Heleno, Ministro-Chefe do Gabinete de Segurança Institucional da Presidência da República; Roberto Campos Neto, Presidente do Banco Central; Senador Fernando Bezerra Coelho, Líder do Governo no Senado Federal; Senador Marcio Bittar (MDB/AC), Vice-líder do Governo no Congresso Nacional; e Deputado Ricardo Barros (PP/PR), Líder do Governo na Câmara dos Deputados""","""Palácio do Planalto"""
