"DIA","SEM_COMPROMISSO","DURACAO_DIA","INICIO","FIM","DURACAO_COMPROMISSO","TITULO","LOCAL"
"31-03-2021","Não","340","09:00","10:30","90","""1ª Reunião do Comitê de Coordenação Nacional para Enfrentamento da Pandemia da Covid-19""","""Palácio do Planalto"""
"31-03-2021","Não","340","11:15","12:00","45","""João Roma, Ministro de Estado da Cidadania; Pedro Guimarães, Presidente da CAIXA; e Gustavo Canuto, Presidente da Dataprev""","""Palácio do Planalto"""
"31-03-2021","Não","340","14:30","14:50","20","""Fábio Faria, Ministro de Estados das Comunicações""","""Palácio do Planalto"""
"31-03-2021","Não","340","15:00","15:30","30","""Pedro Cesar Sousa, Subchefe para Assuntos Jurídicos da Secretaria-Geral da Presidência da República""","""Palácio do Planalto"""
"31-03-2021","Não","340","15:45","16:15","30","""Braga Netto, Ministro de Estado da Defesa""","""Palácio do Planalto"""
"31-03-2021","Não","340","16:15","16:45","30","""Professor Valdiney Gouveia, Reitor da Universidade Federal da Paraíba""","""Palácio do Planalto"""
"31-03-2021","Não","340","16:45","17:20","35","""Braga Netto, Ministro de Estado da Defesa""","""Palácio do Planalto"""
"31-03-2021","Não","340","17:30","18:00","30","""Anderson Torres, Ministro de Estado da Justiça e Segurança Pública; e Marcos Pontes, Ministro de Estado da Ciência, Tecnologia e Inovações""","""Palácio do Planalto"""
"31-03-2021","Não","340","18:00","18:30","30","""Anderson Torres, Ministro de Estado da Justiça e Segurança Pública""","""Palácio do Planalto"""
