"DIA","SEM_COMPROMISSO","DURACAO_DIA","INICIO","FIM","DURACAO_COMPROMISSO","TITULO","LOCAL"
"16-07-2020","Não","140","10:00","10:20","20","""Braga Netto, Ministro-Chefe da Casa Civil da Presidência da República (videoconferência)""","""Palácio da Alvorada"""
"16-07-2020","Não","140","11:00","11:30","30","""Luiz Eduardo Ramos, Ministro-Chefe da Secretaria de Governo da Presidência da República; e Deputado Vitor Hugo (PSL/GO), Líder do Governo na Câmara dos Deputados (videoconferência)""","""Palácio da Alvorada"""
"16-07-2020","Não","140","15:00","15:10","10","""Braga Netto, Ministro-Chefe da Casa Civil da Presidência da República; e Rogério Marinho, Ministro de Estado do Desenvolvimento Regional (videoconferência)""","""Palácio da Alvorada"""
"16-07-2020","Não","140","16:00","17:00","60","""Solenidade de Posse do senhor Milton Ribeiro, Ministro de Estado da Educação (videoconferência)""","""Palácio da Alvorada"""
"16-07-2020","Não","140","17:00","17:20","20","""Jorge Antonio de Oliveira, Ministro-Chefe da Secretaria-Geral da Presidência da República (videoconferência)""","""Palácio da Alvorada"""
