"DIA","SEM_COMPROMISSO","DURACAO_DIA","INICIO","FIM","DURACAO_COMPROMISSO","TITULO","LOCAL"
"02-07-2020","Não","335","09:20","10:00","40","""Ernesto Araújo, Ministro de Estado das Relações Exteriores""","""Palácio do Planalto"""
"02-07-2020","Não","335","10:00","12:20","140","""LVI Cúpula de Chefes de Estado do Mercosul e Estados Associados (videoconferência)""","""Palácio do Planalto"""
"02-07-2020","Não","335","13:00","14:15","75","""Deputado Fábio Ramalho (MDB/MG)""","""Palácio do Planalto"""
"02-07-2020","Não","335","15:00","16:00","60","""André Luiz de Almeida, Ministro de Estado da Justiça e Segurança Pública; e Jorge Antonio de Oliveira, Ministro-Chefe da Secretaria-Geral da Presidência da República""","""Palácio do Planalto"""
"02-07-2020","Não","335","16:00","16:20","20","""André Luiz de Almeida, Ministro de Estado da Justiça e Segurança Pública; Jorge Antonio de Oliveira, Ministro-Chefe da Secretaria-Geral da Presidência da República; e José Levi Mello do Amaral Júnior, Advogado-Geral da União""","""Palácio do Planalto"""
