"DIA","SEM_COMPROMISSO","DURACAO_DIA","INICIO","FIM","DURACAO_COMPROMISSO","TITULO","LOCAL"
"26-01-2021","Não","255","09:00","10:00","60","""Latin America Investment Conference (videoconferência)""","""Palácio do Planalto"""
"26-01-2021","Não","255","10:20","10:50","30","""Fernando Azevedo, Ministro de Estado da Defesa""","""Palácio do Planalto"""
"26-01-2021","Não","255","11:00","11:30","30","""Onyx Lorenzoni, Ministro de Estado da Cidadania""","""Palácio do Planalto"""
"26-01-2021","Não","255","14:00","14:30","30","""Paulo Skaf, Presidente da Federação das Indústrias do estado de São Paulo - FIESP""","""Palácio do Planalto"""
"26-01-2021","Não","255","15:00","15:30","30","""Pedro Cesar Sousa, Ministro-Chefe da Secretaria-Geral da Presidência da República interino""","""Palácio do Planalto"""
"26-01-2021","Não","255","16:00","16:30","30","""André Luiz de Almeida, Ministro de Estado da Justiça e Segurança Pública""","""Palácio do Planalto"""
"26-01-2021","Não","255","19:15","20:00","45","""Celebração do Dia Nacional da Índia""","""Brasília"""
