"DIA","SEM_COMPROMISSO","DURACAO_DIA","INICIO","FIM","DURACAO_COMPROMISSO","TITULO","LOCAL"
"22-04-2021","Não","320","09:00","11:00","120","""Cúpula de Líderes sobre o Clima (videoconferência)""","""Palácio do Planalto"""
"22-04-2021","Não","320","11:30","12:00","30","""Onyx Lorenzoni, Ministro-Chefe da Secretaria-Geral da Presidência da República""","""Palácio do Planalto"""
"22-04-2021","Não","320","14:00","14:30","30","""Marcos Pontes, Ministro de Estado da Ciência, Tecnologia e Inovações""","""Palácio do Planalto"""
"22-04-2021","Não","320","14:30","15:00","30","""André Mendonça, Ministro da Advocacia-Geral da União""","""Palácio do Planalto"""
"22-04-2021","Não","320","15:00","15:55","55","""Gilson Machado, Ministro de Estado do Turismo""","""Palácio do Planalto"""
"22-04-2021","Não","320","15:55","16:15","20","""Pedro Cesar Sousa, Subchefe para Assuntos Jurídicos da Secretaria-Geral da Presidência da República""","""Palácio do Planalto"""
"22-04-2021","Não","320","16:20","16:40","20","""Deputado Ricardo Barros (PP/PR), Líder do Governo na Câmara dos Deputados""","""Palácio do Planalto"""
"22-04-2021","Não","320","16:40","16:55","15","""Braga Netto, Ministro de Estado da Defesa""","""Palácio do Planalto"""
